Constraints in RDBMS

1. Create new table dept100 having same structure and data as that of dept table.
mysql> create table dept100 as select * from dept;
Query OK, 4 rows affected (0.02 sec)
Records: 4  Duplicates: 0  Warnings: 0

mysql> select * from dept100;
+--------+------------+----------+
| DEPTNO | DNAME      | LOC      |
+--------+------------+----------+
|     10 | ACCOUNTING | NEW YORK |
|     20 | RESEARCH   | DALLAS   |
|     30 | SALES      | CHICAGO  |
|     40 | OPERATIONS | BOSTON   |
+--------+------------+----------+
4 rows in set (0.00 sec)


1.Create new table emp100 having same structure and data as that of emp table.
mysql> create table emp100 as select * from emp;
Query OK, 14 rows affected (0.04 sec)
Records: 14  Duplicates: 0  Warnings: 0

mysql> select * from emp100;
+-------+--------+-----------+------+------------+---------+---------+--------+
| EMPNO | ENAME  | JOB       | MGR  | HIREDATE   | SAL     | COMM    | DEPTNO |
+-------+--------+-----------+------+------------+---------+---------+--------+
|  7369 | SMITH  | CLERK     | 7902 | 1980-12-17 |  880.00 |    NULL |     20 |
|  7499 | ALLEN  | SALESMAN  | 7698 | 1981-02-20 | 1760.00 |  300.00 |     30 |
|  7521 | WARD   | SALESMAN  | 7698 | 1981-02-22 | 1375.00 |  500.00 |     30 |
|  7566 | JONES  | MANAGER   | 7839 | 1981-04-02 | 3272.50 |    NULL |     20 |
|  7654 | MARTIN | SALESMAN  | 7698 | 1981-09-28 | 1375.00 | 1400.00 |     30 |
|  7698 | BLAKE  | MANAGER   | 7839 | 1981-05-01 | 3135.00 |    NULL |     30 |
|  7782 | CLARK  | MANAGER   |  777 | 1981-06-09 | 3099.25 |    NULL |     10 |
|  7788 | SCOTT  | ANALYST   | 7566 | 1982-12-09 | 3300.00 |    NULL |     20 |
|  7839 | KING   | PRESIDENT |  777 | 1981-11-17 | 6325.00 |    NULL |     10 |
|  7844 | TURNER | SALESMAN  | 7698 | 1981-09-08 | 1650.00 |    0.00 |     30 |
|  7876 | ADAMS  | CLERK     | 7788 | 1983-01-12 | 1210.00 |    NULL |     20 |
|  7900 | JAMES  | CLERK     | 7698 | 1981-12-03 | 1045.00 |    NULL |     30 |
|  7902 | FORD   | ANALYST   | 7566 | 1981-12-03 | 3300.00 |    NULL |     20 |
|  7934 | MILLER | CLERK     |  777 | 1982-01-23 | 1644.50 |    NULL |     10 |
+-------+--------+-----------+------+------------+---------+---------+--------+
14 rows in set (0.00 sec)



2.Add primary key constraint on deptno for dept100 table.
mysql> alter table dept100
    -> add constraint pk_deptno primary key(deptno);
Query OK, 0 rows affected (0.05 sec)
Records: 0  Duplicates: 0  Warnings: 0

mysql> describe dept100;
+--------+-------------+------+-----+---------+-------+
| Field  | Type        | Null | Key | Default | Extra |
+--------+-------------+------+-----+---------+-------+
| DEPTNO | int         | NO   | PRI | NULL    |       |
| DNAME  | varchar(14) | YES  |     | NULL    |       |
| LOC    | varchar(13) | YES  |     | NULL    |       |
+--------+-------------+------+-----+---------+-------+
3 rows in set (0.00 sec)



3.Add primary key constraint on empno for emp100 table. Check structure of both the tables.
mysql> alter table emp100
    -> add constraint pk_empno primary key(empno);
Query OK, 0 rows affected (0.06 sec)
Records: 0  Duplicates: 0  Warnings: 0

mysql> describe emp100;
+----------+--------------+------+-----+---------+-------+
| Field    | Type         | Null | Key | Default | Extra |
+----------+--------------+------+-----+---------+-------+
| EMPNO    | int          | NO   | PRI | NULL    |       |
| ENAME    | varchar(12)  | YES  |     | NULL    |       |
| JOB      | varchar(9)   | YES  |     | NULL    |       |
| MGR      | int          | YES  |     | NULL    |       |
| HIREDATE | date         | YES  |     | NULL    |       |
| SAL      | decimal(7,2) | YES  |     | NULL    |       |
| COMM     | decimal(7,2) | YES  |     | NULL    |       |
| DEPTNO   | int          | YES  |     | NULL    |       |
+----------+--------------+------+-----+---------+-------+
8 rows in set (0.00 sec)



================================================================================================
2. Create following tables for given schema. Apply constraints as mentioned in the schema.
trainer(tid PK, tname not null , cid fk, salary default 20000,experience in years check >10 )
tid     tname            cid        salary      experience
----------------------------------------------------------------
t1      Amit             c2          your   own   data 
t2      Rajan            c1          your   own   data  
t3      Shruti           c2          your   own   data
t4      Arti             c2          your   own   data 
t5      Sameer           c3          your   own   data 
t6      Sanjay           null        your   own   data 
t7      Soha             null        your   own   data	

Use  on  delete set null clause on cid while creating table.


course(cid pk, cname unique not null, fees default500)

cid         cname                         fees
----------------------------------------------------      
 c1          Core                         7000 
 c2          Linux                        8000 
 c3          Data Structure              10000 
 c4          Python                      12000    
 c5          Dot Net                       null

Try adding following data in the trainer table
 (t2,'Mahesh',null,16000,12)
 (t8,'Meena',c3,25000,11)
 (t9,null,c2,30000,10)
 (t10,'Soham',c2,35000,8)
 (t11,'Anil',c3,null,11)
Try on delete set null.
Drop table trainer and create it again with on delete cascade clause
Try on delete  cascade on trainer table.

--------------------Answer------------------------------------------------
mysql> create table course(
    -> cid varchar(15) ,
    -> cname varchar(15) unique not null,
    -> fees int default 500,
    -> constraint pk_cid primary key(cid) );
Query OK, 0 rows affected (0.02 sec)

mysql> insert into course values
    -> ("c1", "Core", 7000 ),
    -> ("c2", "Linux", 8000),
    -> ("c3", "Data Structure", 10000),
    -> ("c4", "Python",12000),
    -> ("c5", "Dot Net", null);
Query OK, 5 rows affected (0.01 sec)
Records: 5  Duplicates: 0  Warnings: 0

mysql> select * from course;
+-----+----------------+-------+
| cid | cname          | fees  |
+-----+----------------+-------+
| c1  | Core           |  7000 |
| c2  | Linux          |  8000 |
| c3  | Data Structure | 10000 |
| c4  | Python         | 12000 |
| c5  | Dot Net        |  NULL |
+-----+----------------+-------+
5 rows in set (0.00 sec)


create table trainer (
    tid varchar(5),
    tname varchar(15) not null,
    cid varchar(10),
    salary int default 20000,
    experience int check (experience > 10),
    constraint pk_tid primary key (tid),
    constraint fk_trainer_cid foreign key (cid) references course(cid) on delete set null
);

mysql> insert into trainer values
    ->      ( "t1", "Amit", "c2", 20000, 12),
    ->      ("t2", "Rajan", "c1", 30000, 14),
    ->      ("t3", "Shruti", "c2", 34000,15),
    ->      ("t4", "Arti", "c2", 45000, 16),
    ->      ("t5", "Sameer", "c3", 60000,12),
    ->      ("t6", "Sanjay", null, 35000,14),
    ->      ("t7", "Soha", null,43000,17);
Query OK, 7 rows affected (0.01 sec)
Records: 7  Duplicates: 0  Warnings: 0

mysql> select * from trainer;
+-----+--------+------+--------+------------+
| tid | tname  | cid  | salary | experience |
+-----+--------+------+--------+------------+
| t1  | Amit   | c2   |  20000 |         12 |
| t2  | Rajan  | c1   |  30000 |         14 |
| t3  | Shruti | c2   |  34000 |         15 |
| t4  | Arti   | c2   |  45000 |         16 |
| t5  | Sameer | c3   |  60000 |         12 |
| t6  | Sanjay | NULL |  35000 |         14 |
| t7  | Soha   | NULL |  43000 |         17 |
+-----+--------+------+--------+------------+
7 rows in set (0.00 sec)

Q Try adding following data in the trainer table
 (t2,'Mahesh',null,16000,12)
 (t8,'Meena',c3,25000,11)
 (t9,null,c2,30000,10)
 (t10,'Soham',c2,35000,8)
 (t11,'Anil',c3,null,11)

mysql> insert into trainer values
    -> ("t2", "Mahesh", null,16000,12),
    -> ("t8", "Meena","c3",25000,11),
    -> ("t9", null, "c2", 30000, 8),
    -> ("t10", "Anil","c3",null,11);
ERROR 1062 (23000): Duplicate entry 't2' for key 'trainer.PRIMARY'

------Try on delete set null.---

mysql> delete from course
    -> where cid="c3";
Query OK, 1 row affected (0.02 sec)

mysql> select * from course;
+-----+---------+-------+
| cid | cname   | fees  |
+-----+---------+-------+
| c1  | Core    |  7000 |
| c2  | Linux   |  8000 |
| c4  | Python  | 12000 |
| c5  | Dot Net |  NULL |
+-----+---------+-------+
4 rows in set (0.00 sec)

mysql> select * from trainer;
+-----+--------+------+--------+------------+
| tid | tname  | cid  | salary | experience |
+-----+--------+------+--------+------------+
| t1  | Amit   | c2   |  20000 |         12 |
| t2  | Rajan  | c1   |  30000 |         14 |
| t3  | Shruti | c2   |  34000 |         15 |
| t4  | Arti   | c2   |  45000 |         16 |
| t5  | Sameer | NULL |  60000 |         12 |
| t6  | Sanjay | NULL |  35000 |         14 |
| t7  | Soha   | NULL |  43000 |         17 |
+-----+--------+------+--------+------------+
7 rows in set (0.00 sec)

mysql> delete from course
    -> where cid="c3";
Query OK, 1 row affected (0.02 sec)

mysql> select * from course;
+-----+---------+-------+
| cid | cname   | fees  |
+-----+---------+-------+
| c1  | Core    |  7000 |
| c2  | Linux   |  8000 |
| c4  | Python  | 12000 |
| c5  | Dot Net |  NULL |
+-----+---------+-------+
4 rows in set (0.00 sec)

mysql> select * from trainer;
+-----+--------+------+--------+------------+
| tid | tname  | cid  | salary | experience |
+-----+--------+------+--------+------------+
| t1  | Amit   | c2   |  20000 |         12 |
| t2  | Rajan  | c1   |  30000 |         14 |
| t3  | Shruti | c2   |  34000 |         15 |
| t4  | Arti   | c2   |  45000 |         16 |
| t5  | Sameer | NULL |  60000 |         12 |
| t6  | Sanjay | NULL |  35000 |         14 |
| t7  | Soha   | NULL |  43000 |         17 |
+-----+--------+------+--------+------------+
7 rows in set (0.00 sec)


Drop table trainer and create it again with on delete cascade clause

mysql> drop table trainer;
Query OK, 0 rows affected (0.04 sec)

mysql> create table trainer (
    ->     tid varchar(5),
    ->     tname varchar(15) not null,
    ->     cid varchar(10),
    ->     salary int default 20000,
    ->     experience int check (experience > 10),
    ->     constraint pk_tid primary key (tid),
    ->     constraint fk_trainer_cid foreign key (cid) references course(cid) on delete cascade );
Query OK, 0 rows affected (0.09 sec)

mysql> insert into trainer values
    ->     ('t1', 'Amit', 'c2', 20000, 12),
    ->     ('t2', 'Rajan', 'c1', 30000, 14),
    ->     ('t3', 'Shruti', 'c2', 34000, 15),
    ->     ('t4', 'Arti', 'c2', 45000, 16),
    ->     ('t5', 'Sameer', 'c3', 60000, 12),
    ->     ('t6', 'Sanjay', null, 35000, 14),
    ->     ('t7', 'Soha', null, 43000, 17);
Query OK, 7 rows affected (0.01 sec)
Records: 7  Duplicates: 0  Warnings: 0

mysql> delete from course
    -> where cid="c2";
Query OK, 1 row affected (0.02 sec)

mysql> select * from trainer;
+-----+--------+------+--------+------------+
| tid | tname  | cid  | salary | experience |
+-----+--------+------+--------+------------+
| t2  | Rajan  | c1   |  30000 |         14 |
| t5  | Sameer | c3   |  60000 |         12 |
| t6  | Sanjay | NULL |  35000 |         14 |
| t7  | Soha   | NULL |  43000 |         17 |
+-----+--------+------+--------+------------+
4 rows in set (0.00 sec)

mysql> select * from course;
+-----+----------------+-------+
| cid | cname          | fees  |
+-----+----------------+-------+
| c1  | Core           |  7000 |
| c3  | Data Structure |  2000 |
| c4  | Python         | 12000 |
| c5  | Dot Net        |  NULL |
+-----+----------------+-------+
4 rows in set (0.00 sec)
